{
  "created_at": "2026-09-17T10:04:52.276130Z",
  "items": [
    {
      "applicability": "required",
      "capability_id": "pi-host",
      "evidence_paths": [
        "evidence/pi-host.pi-default.V01-inventory.linux-x86_64-node.mock.32da4799.json",
        "evidence/pi-host.pi-default.V01-inventory.linux-x86_64-node.native.32da4799.json"
      ],
      "identity": {
        "lock_digest": "32da47998e8388a84f291d217b39f105b294dd1f9676831c5e56a2709a8d28ca",
        "runtime_digest": "06342bbf9238f49e7fab7761b9df3fdffcfeec49bd589aa582fe50802f3d4af2",
        "policy_digest": "4f5ee0bad6ccfb9f0099ebf4fd60047869099ad7b3461185cac71826e2f88fdd",
        "resource_digest": "b1d031a940f1348bd2e80f17a4cc1325903eb72806f5a29ed5578d0d921b5d60",
        "machine_contract_digest": "b4c040e061a67b7844b5d63649e1e9e9486d2a88939a263164f65d6eb1bd562f"
      },
      "levels": [
        "mock",
        "native"
      ],
      "platform": {
        "architecture": "x86_64",
        "engine": "node",
        "os": "linux"
      },
      "scenario_id": "pi-default.V01-inventory",
      "selection_reason": "规格要求的软件与原生验证"
    },
    {
      "applicability": "required",
      "capability_id": "pi-host",
      "evidence_paths": [
        "evidence/pi-host.pi-default.V03-dependencies.linux-x86_64-node.mock.32da4799.json",
        "evidence/pi-host.pi-default.V03-dependencies.linux-x86_64-node.native.32da4799.json"
      ],
      "identity": {
        "lock_digest": "32da47998e8388a84f291d217b39f105b294dd1f9676831c5e56a2709a8d28ca",
        "runtime_digest": "06342bbf9238f49e7fab7761b9df3fdffcfeec49bd589aa582fe50802f3d4af2",
        "policy_digest": "4f5ee0bad6ccfb9f0099ebf4fd60047869099ad7b3461185cac71826e2f88fdd",
        "resource_digest": "b1d031a940f1348bd2e80f17a4cc1325903eb72806f5a29ed5578d0d921b5d60",
        "machine_contract_digest": "b4c040e061a67b7844b5d63649e1e9e9486d2a88939a263164f65d6eb1bd562f"
      },
      "levels": [
        "mock",
        "native"
      ],
      "platform": {
        "architecture": "x86_64",
        "engine": "node",
        "os": "linux"
      },
      "scenario_id": "pi-default.V03-dependencies",
      "selection_reason": "规格要求的软件与原生验证"
    },
    {
      "applicability": "required",
      "capability_id": "pi-host",
      "evidence_paths": [
        "evidence/pi-host.pi-default.V04-launch.linux-x86_64-node.mock.32da4799.json",
        "evidence/pi-host.pi-default.V04-launch.linux-x86_64-node.native.32da4799.json"
      ],
      "identity": {
        "lock_digest": "32da47998e8388a84f291d217b39f105b294dd1f9676831c5e56a2709a8d28ca",
        "runtime_digest": "06342bbf9238f49e7fab7761b9df3fdffcfeec49bd589aa582fe50802f3d4af2",
        "policy_digest": "4f5ee0bad6ccfb9f0099ebf4fd60047869099ad7b3461185cac71826e2f88fdd",
        "resource_digest": "b1d031a940f1348bd2e80f17a4cc1325903eb72806f5a29ed5578d0d921b5d60",
        "machine_contract_digest": "b4c040e061a67b7844b5d63649e1e9e9486d2a88939a263164f65d6eb1bd562f"
      },
      "levels": [
        "mock",
        "native"
      ],
      "platform": {
        "architecture": "x86_64",
        "engine": "node",
        "os": "linux"
      },
      "scenario_id": "pi-default.V04-launch",
      "selection_reason": "规格要求的软件与原生验证"
    },
    {
      "applicability": "required",
      "capability_id": "pi-host",
      "evidence_paths": [
        "evidence/pi-host.pi-default.V05-resources.linux-x86_64-node.mock.32da4799.json",
        "evidence/pi-host.pi-default.V05-resources.linux-x86_64-node.native.32da4799.json"
      ],
      "identity": {
        "lock_digest": "32da47998e8388a84f291d217b39f105b294dd1f9676831c5e56a2709a8d28ca",
        "runtime_digest": "06342bbf9238f49e7fab7761b9df3fdffcfeec49bd589aa582fe50802f3d4af2",
        "policy_digest": "4f5ee0bad6ccfb9f0099ebf4fd60047869099ad7b3461185cac71826e2f88fdd",
        "resource_digest": "b1d031a940f1348bd2e80f17a4cc1325903eb72806f5a29ed5578d0d921b5d60",
        "machine_contract_digest": "b4c040e061a67b7844b5d63649e1e9e9486d2a88939a263164f65d6eb1bd562f"
      },
      "levels": [
        "mock",
        "native"
      ],
      "platform": {
        "architecture": "x86_64",
        "engine": "node",
        "os": "linux"
      },
      "scenario_id": "pi-default.V05-resources",
      "selection_reason": "规格要求的软件与原生验证"
    },
    {
      "applicability": "required",
      "capability_id": "pi-host",
      "evidence_paths": [
        "evidence/pi-host.pi-default.V08-recovery.linux-x86_64-node.mock.32da4799.json",
        "evidence/pi-host.pi-default.V08-recovery.linux-x86_64-node.native.32da4799.json"
      ],
      "identity": {
        "lock_digest": "32da47998e8388a84f291d217b39f105b294dd1f9676831c5e56a2709a8d28ca",
        "runtime_digest": "06342bbf9238f49e7fab7761b9df3fdffcfeec49bd589aa582fe50802f3d4af2",
        "policy_digest": "4f5ee0bad6ccfb9f0099ebf4fd60047869099ad7b3461185cac71826e2f88fdd",
        "resource_digest": "b1d031a940f1348bd2e80f17a4cc1325903eb72806f5a29ed5578d0d921b5d60",
        "machine_contract_digest": "b4c040e061a67b7844b5d63649e1e9e9486d2a88939a263164f65d6eb1bd562f"
      },
      "levels": [
        "mock",
        "native"
      ],
      "platform": {
        "architecture": "x86_64",
        "engine": "node",
        "os": "linux"
      },
      "scenario_id": "pi-default.V08-recovery",
      "selection_reason": "规格要求的软件与原生验证"
    },
    {
      "applicability": "required",
      "capability_id": "pi-host",
      "evidence_paths": [
        "evidence/pi-host.pi-default.V09-supervision.linux-x86_64-node.mock.32da4799.json",
        "evidence/pi-host.pi-default.V09-supervision.linux-x86_64-node.native.32da4799.json"
      ],
      "identity": {
        "lock_digest": "32da47998e8388a84f291d217b39f105b294dd1f9676831c5e56a2709a8d28ca",
        "runtime_digest": "06342bbf9238f49e7fab7761b9df3fdffcfeec49bd589aa582fe50802f3d4af2",
        "policy_digest": "4f5ee0bad6ccfb9f0099ebf4fd60047869099ad7b3461185cac71826e2f88fdd",
        "resource_digest": "b1d031a940f1348bd2e80f17a4cc1325903eb72806f5a29ed5578d0d921b5d60",
        "machine_contract_digest": "b4c040e061a67b7844b5d63649e1e9e9486d2a88939a263164f65d6eb1bd562f"
      },
      "levels": [
        "mock",
        "native"
      ],
      "platform": {
        "architecture": "x86_64",
        "engine": "node",
        "os": "linux"
      },
      "scenario_id": "pi-default.V09-supervision",
      "selection_reason": "规格要求的软件与原生验证"
    },
    {
      "applicability": "required",
      "capability_id": "pi-host",
      "evidence_paths": [
        "evidence/pi-host.pi-default.V10-manager.linux-x86_64-node.mock.32da4799.json",
        "evidence/pi-host.pi-default.V10-manager.linux-x86_64-node.native.32da4799.json"
      ],
      "identity": {
        "lock_digest": "32da47998e8388a84f291d217b39f105b294dd1f9676831c5e56a2709a8d28ca",
        "runtime_digest": "06342bbf9238f49e7fab7761b9df3fdffcfeec49bd589aa582fe50802f3d4af2",
        "policy_digest": "4f5ee0bad6ccfb9f0099ebf4fd60047869099ad7b3461185cac71826e2f88fdd",
        "resource_digest": "b1d031a940f1348bd2e80f17a4cc1325903eb72806f5a29ed5578d0d921b5d60",
        "machine_contract_digest": "b4c040e061a67b7844b5d63649e1e9e9486d2a88939a263164f65d6eb1bd562f"
      },
      "levels": [
        "mock",
        "native"
      ],
      "platform": {
        "architecture": "x86_64",
        "engine": "node",
        "os": "linux"
      },
      "scenario_id": "pi-default.V10-manager",
      "selection_reason": "规格要求的软件与原生验证"
    },
    {
      "applicability": "required",
      "capability_id": "pi-host",
      "evidence_paths": [
        "evidence/pi-host.pi-default.V13-permissions.linux-x86_64-node.mock.32da4799.json",
        "evidence/pi-host.pi-default.V13-permissions.linux-x86_64-node.native.32da4799.json"
      ],
      "identity": {
        "lock_digest": "32da47998e8388a84f291d217b39f105b294dd1f9676831c5e56a2709a8d28ca",
        "runtime_digest": "06342bbf9238f49e7fab7761b9df3fdffcfeec49bd589aa582fe50802f3d4af2",
        "policy_digest": "4f5ee0bad6ccfb9f0099ebf4fd60047869099ad7b3461185cac71826e2f88fdd",
        "resource_digest": "b1d031a940f1348bd2e80f17a4cc1325903eb72806f5a29ed5578d0d921b5d60",
        "machine_contract_digest": "b4c040e061a67b7844b5d63649e1e9e9486d2a88939a263164f65d6eb1bd562f"
      },
      "levels": [
        "mock",
        "native"
      ],
      "platform": {
        "architecture": "x86_64",
        "engine": "node",
        "os": "linux"
      },
      "scenario_id": "pi-default.V13-permissions",
      "selection_reason": "规格要求的软件与原生验证"
    },
    {
      "applicability": "required",
      "capability_id": "pi-host",
      "evidence_paths": [
        "evidence/pi-host.pi-default.V17-optional-software.linux-x86_64-node.mock.32da4799.json",
        "evidence/pi-host.pi-default.V17-optional-software.linux-x86_64-node.native.32da4799.json"
      ],
      "identity": {
        "lock_digest": "32da47998e8388a84f291d217b39f105b294dd1f9676831c5e56a2709a8d28ca",
        "runtime_digest": "06342bbf9238f49e7fab7761b9df3fdffcfeec49bd589aa582fe50802f3d4af2",
        "policy_digest": "4f5ee0bad6ccfb9f0099ebf4fd60047869099ad7b3461185cac71826e2f88fdd",
        "resource_digest": "b1d031a940f1348bd2e80f17a4cc1325903eb72806f5a29ed5578d0d921b5d60",
        "machine_contract_digest": "b4c040e061a67b7844b5d63649e1e9e9486d2a88939a263164f65d6eb1bd562f"
      },
      "levels": [
        "mock",
        "native"
      ],
      "platform": {
        "architecture": "x86_64",
        "engine": "node",
        "os": "linux"
      },
      "scenario_id": "pi-default.V17-optional-software",
      "selection_reason": "规格要求的软件与原生验证"
    },
    {
      "applicability": "required",
      "capability_id": "pi-host",
      "evidence_paths": [
        "evidence/pi-host.pi-default.V20-cold-rebuild.linux-x86_64-node.mock.32da4799.json",
        "evidence/pi-host.pi-default.V20-cold-rebuild.linux-x86_64-node.native.32da4799.json"
      ],
      "identity": {